date,ticker,article_id,sentiment_score,sentiment_label,positive_score,negative_score,neutral_score,news_preview,model_version,processed_at
2026-06-23,VHM,VHM_ART_003,-0.002681325189769268,Neutral,0.014689036644995213,0.01737036183476448,0.967940628528595,"VHM warns of rising credit costs and narrowing net interest margin in H1 2026, c...",finbert_v1.0,2026-06-27 12:15:36
2026-06-23,VIC,VIC_ART_000,-0.9028259515762329,Negative,0.0407898873090744,0.9436158537864685,0.015594292432069778,"Vingroup receives 'Buy' recommendation from leading brokerage, target price rais...",finbert_v1.0,2026-06-27 12:15:36
2026-06-23,VIC,VIC_ART_001,-0.010182417929172516,Neutral,0.009309040382504463,0.01949145831167698,0.9711994528770447,Vingroup faces margin compression as operating costs rise faster than revenue in...,finbert_v1.0,2026-06-27 12:15:36
2026-06-23,VIC,VIC_ART_002,-0.2903267741203308,Negative,0.32894015312194824,0.619266927242279,0.05179290845990181,VIC announces interim dividend of 2691 VND per share with record payout ratio...,finbert_v1.0,2026-06-27 12:15:36
2026-06-23,VIC,VIC_ART_003,0.0009346473962068558,Neutral,0.012463602237403393,0.011528954841196537,0.9760075211524963,"Vingroup misses Q2 profit targets, net profit 1 trillion VND, down 12% from prev...",finbert_v1.0,2026-06-27 12:15:36
2026-06-23,VNM,VNM_ART_000,-0.028346773236989975,Neutral,0.01828579604625702,0.046632569283246994,0.9350816607475281,VNM stock declines 2.3 on profit taking after strong Q1 performance...,finbert_v1.0,2026-06-27 12:15:36
2026-06-23,VNM,VNM_ART_001,-0.0033849580213427544,Neutral,0.013750861398875713,0.017135819420218468,0.969113290309906,"VNM warns of rising credit costs and narrowing net interest margin in H1 2026, c...",finbert_v1.0,2026-06-27 12:15:36
2026-06-23,VNM,VNM_ART_002,-0.9275107979774475,Negative,0.024078866466879845,0.9515896439552307,0.024331552907824516,VNM upgraded to 'Outperform' by investment bank citing strong fundamentals and g...,finbert_v1.0,2026-06-27 12:15:36
2026-06-23,VNM,VNM_ART_003,-0.9333670139312744,Negative,0.022956205531954765,0.9563232064247131,0.02072049118578434,"Vinamilk (VNM) reports Q2 2026 net profit of 3 trillion VND, up 11% year-over-ye...",finbert_v1.0,2026-06-27 12:15:36
2026-06-23,VPB,VPB_ART_000,0.01436700765043497,Neutral,0.025219930335879326,0.010852922685444355,0.963927149772644,"Vietnam Prosperity Bank faces regulatory scrutiny over compliance requirements, ...",finbert_v1.0,2026-06-27 12:15:36
2026-06-23,VPB,VPB_ART_001,-0.8528532981872559,Negative,0.0508316345512867,0.9036849141120911,0.045483507215976715,VPB stock gains 2.8% as Banking sector leads market rally...,finbert_v1.0,2026-06-27 12:15:36
2026-06-23,VPB,VPB_ART_002,-0.9179365038871765,Negative,0.03172844275832176,0.9496649503707886,0.01860659196972847,"Vietnam Prosperity Bank opens new branch network in 3 provinces across Vietnam, ...",finbert_v1.0,2026-06-27 12:15:36
2026-06-23,VPB,VPB_ART_003,-0.9278760552406311,Negative,0.02382446452975273,0.9517005085945129,0.0244749803096056,VPB upgraded to 'Outperform' by investment bank citing strong fundamentals and g...,finbert_v1.0,2026-06-27 12:15:36
2026-06-24,ACB,ACB_ART_000,-0.9270521998405457,Negative,0.02457473985850811,0.9516269564628601,0.02379823476076126,ACB upgraded to 'Outperform' by investment bank citing strong fundamentals and g...,finbert_v1.0,2026-06-27 12:15:36
2026-06-24,ACB,ACB_ART_001,-0.003887527622282505,Neutral,0.013390370644629002,0.017277898266911507,0.9693318009376526,"ACB warns of rising credit costs and narrowing net interest margin in H1 2026, c...",finbert_v1.0,2026-06-27 12:15:36
2026-06-24,ACB,ACB_ART_002,-0.9215034246444702,Negative,0.030151207000017166,0.9516546130180359,0.018194163218140602,"Asia Commercial Bank opens new branch network in 8 provinces across Vietnam, str...",finbert_v1.0,2026-06-27 12:15:36
2026-06-24,BID,BID_ART_000,-0.0139956995844841,Neutral,0.008779209107160568,0.02277490869164467,0.9684458374977112,Investment & Development Bank faces margin compression as operating costs rise f...,finbert_v1.0,2026-06-27 12:15:36
2026-06-24,BID,BID_ART_001,0.008461389690637589,Neutral,0.023543423041701317,0.015082033351063728,0.9613746404647827,"BID warns of rising credit costs and narrowing net interest margin in H1 2026, c...",finbert_v1.0,2026-06-27 12:15:36
2026-06-24,BID,BID_ART_002,-0.9216823577880859,Negative,0.03011983446776867,0.9518021941184998,0.018077954649925232,Investment & Development Bank opens new branch network in 8 provinces across Vie...,finbert_v1.0,2026-06-27 12:15:36
2026-06-24,BID,BID_ART_003,0.7069631814956665,Positive,0.8467875719070435,0.13982440531253815,0.013387964107096195,Investment & Development Bank Board approves cash dividend of 3810 VND per share...,finbert_v1.0,2026-06-27 12:15:36
2026-06-24,HDB,HDB_ART_000,-0.9058155417442322,Negative,0.0374261811375618,0.9432417154312134,0.019332101568579674,"Housing Development Bank receives 'Buy' recommendation from leading brokerage, t...",finbert_v1.0,2026-06-27 12:15:36
2026-06-24,HDB,HDB_ART_001,-0.9319043159484863,Negative,0.023237906396389008,0.9551421999931335,0.02161986567080021,"Housing Development Bank (HDB) reports Q2 2026 net profit of 4 trillion VND, up ...",finbert_v1.0,2026-06-27 12:15:36
2026-06-24,HDB,HDB_ART_002,0.012976649217307568,Neutral,0.023910468444228172,0.010933819226920605,0.9651556611061096,Housing Development Bank downgraded to 'Hold' by securities firm citing rising b...,finbert_v1.0,2026-06-27 12:15:36
2026-06-24,HDB,HDB_ART_003,0.0009052511304616928,Neutral,0.01223861612379551,0.011333364993333817,0.9764280915260315,"Housing Development Bank misses Q2 profit targets, net profit 2 trillion VND, do...",finbert_v1.0,2026-06-27 12:15:36
2026-06-24,HDB,HDB_ART_004,-0.01246730051934719,Neutral,0.017761893570423126,0.030229194089770317,0.952008843421936,HDB stock declines 2.1 on profit taking after strong Q1 performance...,finbert_v1.0,2026-06-27 12:15:36
2026-06-24,MBB,MBB_ART_000,-0.9205427169799805,Negative,0.030507711693644524,0.9510504007339478,0.018441835418343544,Military Commercial Joint Stock Bank opens new branch network in 3 provinces acr...,finbert_v1.0,2026-06-27 12:15:36
2026-06-24,MBB,MBB_ART_001,-0.01601589471101761,Neutral,0.009077447466552258,0.02509334310889244,0.9658291935920715,Military Commercial Joint Stock Bank faces margin compression as operating costs...,finbert_v1.0,2026-06-27 12:15:36
2026-06-24,MBB,MBB_ART_002,-0.9128054976463318,Negative,0.03505263105034828,0.9478581547737122,0.0170892346650362,Military Commercial Joint Stock Bank receives 'Buy' recommendation from leading ...,finbert_v1.0,2026-06-27 12:15:36
2026-06-24,MBB,MBB_ART_003,0.014890342019498348,Neutral,0.02512345090508461,0.010233108885586262,0.9646434783935547,Military Commercial Joint Stock Bank downgraded to 'Hold' by securities firm cit...,finbert_v1.0,2026-06-27 12:15:37
2026-06-24,MSN,MSN_ART_000,-0.03600413352251053,Neutral,0.021915094926953316,0.057919230312108994,0.9201657176017761,MSN stock declines 1.6 on profit taking after strong Q1 performance...,finbert_v1.0,2026-06-27 12:15:37
2026-06-24,MSN,MSN_ART_001,-0.9319643974304199,Negative,0.023451736196875572,0.9554161429405212,0.021132061257958412,"Masan Group (MSN) reports Q2 2026 net profit of 4 trillion VND, up 10% year-over...",finbert_v1.0,2026-06-27 12:15:37
2026-06-24,MSN,MSN_ART_002,-0.20633092522621155,Negative,0.32631978392601013,0.5326507091522217,0.1410294771194458,MSN announces interim dividend of 1342 VND per share with record payout ratio...,finbert_v1.0,2026-06-27 12:15:37
2026-06-24,MSN,MSN_ART_003,-0.0034795692190527916,Neutral,0.013725356198847294,0.017204925417900085,0.9690696597099304,"MSN warns of rising credit costs and narrowing net interest margin in H1 2026, c...",finbert_v1.0,2026-06-27 12:15:37
2026-06-24,MSN,MSN_ART_004,-0.9151557683944702,Negative,0.03468305617570877,0.9498388171195984,0.015478130429983139,Masan Group signs strategic partnership with leading Consumer Goods firm to enha...,finbert_v1.0,2026-06-27 12:15:37
2026-06-24,PGV,PGV_ART_000,-0.9201741814613342,Negative,0.03136460855603218,0.9515388011932373,0.017096616327762604,"Petrovietnam Gas receives 'Buy' recommendation from leading brokerage, target pr...",finbert_v1.0,2026-06-27 12:15:37
2026-06-24,PGV,PGV_ART_001,-0.858589768409729,Negative,0.052429698407649994,0.9110194444656372,0.03655082732439041,PGV stock gains 2.8% as Energy sector leads market rally...,finbert_v1.0,2026-06-27 12:15:37
2026-06-24,PGV,PGV_ART_002,-0.02586192637681961,Neutral,0.009454463608562946,0.03531638905405998,0.9552291035652161,Petrovietnam Gas faces margin compression as operating costs rise faster than re...,finbert_v1.0,2026-06-27 12:15:37
2026-06-24,PLX,PLX_ART_000,-0.001875242218375206,Neutral,0.015839003026485443,0.01771424524486065,0.9664467573165894,"PLX warns of rising credit costs and narrowing net interest margin in H1 2026, c...",finbert_v1.0,2026-06-27 12:15:37
2026-06-24,PLX,PLX_ART_001,-0.3069875240325928,Negative,0.3430224061012268,0.6500099301338196,0.006967734545469284,PLX invests 638 billion VND in new technology platform to digitize customer serv...,finbert_v1.0,2026-06-27 12:15:37
2026-06-24,PLX,PLX_ART_002,-0.9130550622940063,Negative,0.036419909447431564,0.9494749903678894,0.01410508994013071,Petrovietnam Power signs strategic partnership with leading Energy firm to enhan...,finbert_v1.0,2026-06-27 12:15:37
2026-06-24,PLX,PLX_ART_003,-0.8600791096687317,Negative,0.053248774260282516,0.9133278727531433,0.0334232896566391,PLX stock gains 1.9% as Energy sector leads market rally...,finbert_v1.0,2026-06-27 12:15:37
2026-06-24,PLX,PLX_ART_004,0.008933410979807377,Neutral,0.01919245533645153,0.010259044356644154,0.9705485105514526,PLX faces downward pressure from foreign investors selling amid Energy sector we...,finbert_v1.0,2026-06-27 12:15:37
2026-06-24,PNJ,PNJ_ART_000,-0.9291275143623352,Negative,0.02402234822511673,0.9531498551368713,0.022827818989753723,"PNJ announces robust Q2 results with net interest income growing 21% YoY, driven...",finbert_v1.0,2026-06-27 12:15:37
2026-06-24,PNJ,PNJ_ART_001,0.01918487623333931,Neutral,0.029119350016117096,0.009934473782777786,0.9609462022781372,"Phu Nhuan Jewelry faces regulatory scrutiny over compliance requirements, may in...",finbert_v1.0,2026-06-27 12:15:37
2026-06-24,PNJ,PNJ_ART_002,-0.028116658329963684,Neutral,0.021571259945631027,0.04968791827559471,0.9287407994270325,PNJ stock declines 2.5 on profit taking after strong Q1 performance...,finbert_v1.0,2026-06-27 12:15:37
2026-06-24,PNJ,PNJ_ART_003,-0.8337780237197876,Negative,0.05674360319972038,0.8905216455459595,0.05273469537496567,PNJ stock gains 2.2% as Retail sector leads market rally...,finbert_v1.0,2026-06-27 12:15:37
2026-06-24,PNJ,PNJ_ART_004,-0.35733333230018616,Negative,0.27481570839881897,0.6321490406990051,0.09303522855043411,PNJ announces interim dividend of 1599 VND per share with record payout ratio...,finbert_v1.0,2026-06-27 12:15:37
2026-06-24,SAB,SAB_ART_000,0.012972671538591385,Neutral,0.023860543966293335,0.01088787242770195,0.965251624584198,Sabeco downgraded to 'Hold' by securities firm citing rising bad debt concerns...,finbert_v1.0,2026-06-27 12:15:37
2026-06-24,SAB,SAB_ART_001,0.703798770904541,Positive,0.845922589302063,0.14212380349636078,0.011953642591834068,"Sabeco Board approves cash dividend of 3066 VND per share for 2026, payable in S...",finbert_v1.0,2026-06-27 12:15:37
2026-06-24,SAB,SAB_ART_002,-0.8430635929107666,Negative,0.07448317110538483,0.9175467491149902,0.007970095612108707,SAB enters collaboration with international partner to expand Consumer Goods ser...,finbert_v1.0,2026-06-27 12:15:37
2026-06-24,STB,STB_ART_000,-0.277879536151886,Negative,0.3219981789588928,0.5998777151107788,0.07812409102916718,STB announces interim dividend of 1553 VND per share with record payout ratio...,finbert_v1.0,2026-06-27 12:15:37
2026-06-24,STB,STB_ART_001,-0.9224799275398254,Negative,0.030580438673496246,0.9530603885650635,0.016359087079763412,"Sacombank opens new branch network in 9 provinces across Vietnam, strengthening ...",finbert_v1.0,2026-06-27 12:15:37
2026-06-24,STB,STB_ART_002,-0.9332484602928162,Negative,0.023120423778891563,0.9563688635826111,0.020510731264948845,"Sacombank (STB) reports Q2 2026 net profit of 4 trillion VND, up 13% year-over-y...",finbert_v1.0,2026-06-27 12:15:37
2026-06-24,TCB,TCB_ART_000,-0.9170392751693726,Negative,0.03094622492790222,0.9479854702949524,0.021068362519145012,"Techcombank surges to 4892 new accounts in Q2, exceeding customer acquisition ta...",finbert_v1.0,2026-06-27 12:15:37
2026-06-24,TCB,TCB_ART_001,0.5503156781196594,Positive,0.7684780955314636,0.2181624323129654,0.01335941907018423,"Techcombank Board approves cash dividend of 4116 VND per share for 2026, payable...",finbert_v1.0,2026-06-27 12:15:37
2026-06-24,TCB,TCB_ART_002,-0.016267506405711174,Neutral,0.009049126878380775,0.02531663328409195,0.965634286403656,Techcombank faces margin compression as operating costs rise faster than revenue...,finbert_v1.0,2026-06-27 12:15:37
2026-06-24,TCB,TCB_ART_003,-0.2972549796104431,Negative,0.34781306982040405,0.6450680494308472,0.007118841167539358,TCB invests 774 billion VND in new technology platform to digitize customer serv...,finbert_v1.0,2026-06-27 12:15:37
2026-06-24,VCB,VCB_ART_000,-0.8315399885177612,Negative,0.06440497934818268,0.8959449529647827,0.039650093764066696,VCB stock gains 2.0% as Banking sector leads market rally...,finbert_v1.0,2026-06-27 12:15:37
2026-06-24,VCB,VCB_ART_001,0.01836773380637169,Neutral,0.02814021147787571,0.00977247767150402,0.9620873332023621,"Vietcombank faces regulatory scrutiny over compliance requirements, may incur ad...",finbert_v1.0,2026-06-27 12:15:37
2026-06-24,VCB,VCB_ART_002,0.46780481934547424,Positive,0.7276210188865662,0.2598161995410919,0.01256278995424509,"Vietcombank Board approves cash dividend of 3642 VND per share for 2026, payable...",finbert_v1.0,2026-06-27 12:15:37
2026-06-24,VHM,VHM_ART_000,-0.8020131587982178,Negative,0.09540069848299026,0.8974138498306274,0.007185536902397871,VHM enters collaboration with international partner to expand Real Estate servic...,finbert_v1.0,2026-06-27 12:15:37
2026-06-24,VHM,VHM_ART_001,-0.9340177178382874,Negative,0.02264723926782608,0.9566649794578552,0.020687757059931755,"Vinhomes (VHM) reports Q2 2026 net profit of 4 trillion VND, up 18% year-over-ye...",finbert_v1.0,2026-06-27 12:15:37
2026-06-24,VHM,VHM_ART_002,-0.22252678871154785,Negative,0.38513290882110596,0.6076596975326538,0.007207341026514769,VHM invests 1353 billion VND in new technology platform to digitize customer ser...,finbert_v1.0,2026-06-27 12:15:37
2026-06-24,VHM,VHM_ART_003,0.20030853152275085,Positive,0.533473014831543,0.3331644833087921,0.13336250185966492,VHM announces interim dividend of 2451 VND per share with record payout ratio...,finbert_v1.0,2026-06-27 12:15:37
2026-06-24,VHM,VHM_ART_004,-0.8369986414909363,Negative,0.05942476913332939,0.8964233994483948,0.04415184259414673,VHM stock gains 1.7% as Real Estate sector leads market rally...,finbert_v1.0,2026-06-27 12:15:37
2026-06-24,VIC,VIC_ART_000,0.010684741660952568,Neutral,0.022506479173898697,0.011821737512946129,0.9656717777252197,Vingroup downgraded to 'Hold' by securities firm citing rising bad debt concerns...,finbert_v1.0,2026-06-27 12:15:37
2026-06-24,VIC,VIC_ART_001,-0.010182417929172516,Neutral,0.009309040382504463,0.01949145831167698,0.9711994528770447,Vingroup faces margin compression as operating costs rise faster than revenue in...,finbert_v1.0,2026-06-27 12:15:37
2026-06-24,VIC,VIC_ART_002,-0.7567746639251709,Negative,0.0893280878663063,0.846102774143219,0.06456918269395828,VIC experiences increased competition from foreign banks entering Vietnamese Con...,finbert_v1.0,2026-06-27 12:15:37
2026-06-24,VIC,VIC_ART_003,0.0010376311838626862,Neutral,0.01252551656216383,0.011487885378301144,0.9759865999221802,"Vingroup misses Q2 profit targets, net profit 1 trillion VND, down 11% from prev...",finbert_v1.0,2026-06-27 12:15:37
2026-06-24,VNM,VNM_ART_000,-0.9120933413505554,Negative,0.0356258861720562,0.9477192163467407,0.0166548453271389,"Vinamilk receives 'Buy' recommendation from leading brokerage, target price rais...",finbert_v1.0,2026-06-27 12:15:37
2026-06-24,VNM,VNM_ART_001,-0.9290768504142761,Negative,0.02429507113993168,0.9533719420433044,0.02233303338289261,"VNM announces robust Q2 results with net interest income growing 25% YoY, driven...",finbert_v1.0,2026-06-27 12:15:37
2026-06-24,VNM,VNM_ART_002,0.009262584149837494,Neutral,0.01964009553194046,0.010377511382102966,0.9699823260307312,VNM faces downward pressure from foreign investors selling amid Consumer Goods s...,finbert_v1.0,2026-06-27 12:15:37
2026-06-24,VNM,VNM_ART_003,-0.014419701881706715,Neutral,0.009433944709599018,0.023853646591305733,0.9667123556137085,Vinamilk faces margin compression as operating costs rise faster than revenue in...,finbert_v1.0,2026-06-27 12:15:37
2026-06-24,VPB,VPB_ART_000,-0.9055214524269104,Negative,0.039003435522317886,0.944524884223938,0.016471698880195618,"Vietnam Prosperity Bank receives 'Buy' recommendation from leading brokerage, ta...",finbert_v1.0,2026-06-27 12:15:37
2026-06-24,VPB,VPB_ART_001,-0.9172488451004028,Negative,0.032165903598070145,0.9494147300720215,0.018419325351715088,"Vietnam Prosperity Bank opens new branch network in 5 provinces across Vietnam, ...",finbert_v1.0,2026-06-27 12:15:37
2026-06-24,VPB,VPB_ART_002,0.475680947303772,Positive,0.7308767437934875,0.2551957964897156,0.01392743643373251,Vietnam Prosperity Bank Board approves cash dividend of 2587 VND per share for 2...,finbert_v1.0,2026-06-27 12:15:37
2026-06-24,VPB,VPB_ART_003,-0.9103441834449768,Negative,0.03618304803967476,0.9465272426605225,0.01728968881070614,Vietnam Prosperity Bank signs strategic partnership with leading Banking firm to...,finbert_v1.0,2026-06-27 12:15:37
2026-06-24,VPB,VPB_ART_004,-0.9162605404853821,Negative,0.030708743259310722,0.9469692707061768,0.02232191152870655,"Vietnam Prosperity Bank surges to 2547 new accounts in Q2, exceeding customer ac...",finbert_v1.0,2026-06-27 12:15:37
2026-06-25,ACB,ACB_ART_000,0.014457824639976025,Neutral,0.025278253480792046,0.010820428840816021,0.9639012217521667,"Asia Commercial Bank faces regulatory scrutiny over compliance requirements, may...",finbert_v1.0,2026-06-27 12:15:37
2026-06-25,ACB,ACB_ART_001,-0.015767786651849747,Neutral,0.008908911608159542,0.024676699191331863,0.9664143323898315,Asia Commercial Bank faces margin compression as operating costs rise faster tha...,finbert_v1.0,2026-06-27 12:15:37
2026-06-25,ACB,ACB_ART_002,-0.003887527622282505,Neutral,0.013390370644629002,0.017277898266911507,0.9693318009376526,"ACB warns of rising credit costs and narrowing net interest margin in H1 2026, c...",finbert_v1.0,2026-06-27 12:15:37
2026-06-25,ACB,ACB_ART_003,-0.9270521998405457,Negative,0.02457473985850811,0.9516269564628601,0.02379823476076126,ACB upgraded to 'Outperform' by investment bank citing strong fundamentals and g...,finbert_v1.0,2026-06-27 12:15:38
2026-06-25,ACB,ACB_ART_004,-0.9217736124992371,Negative,0.03001110628247261,0.9517847299575806,0.01820416934788227,"Asia Commercial Bank opens new branch network in 7 provinces across Vietnam, str...",finbert_v1.0,2026-06-27 12:15:38
2026-06-25,BID,BID_ART_000,-0.7943752408027649,Negative,0.09916577488183975,0.8935410380363464,0.007293202914297581,BID enters collaboration with international partner to expand Banking services i...,finbert_v1.0,2026-06-27 12:15:38
2026-06-25,BID,BID_ART_001,0.0006143609061837196,Neutral,0.012050085701048374,0.011435724794864655,0.9765141606330872,"Investment & Development Bank misses Q2 profit targets, net profit 1 trillion VN...",finbert_v1.0,2026-06-27 12:15:38
2026-06-25,BID,BID_ART_002,0.012632282450795174,Neutral,0.022450774908065796,0.009818492457270622,0.967730700969696,BID faces downward pressure from foreign investors selling amid Banking sector w...,finbert_v1.0,2026-06-27 12:15:38
2026-06-25,BID,BID_ART_003,-0.9159612655639648,Negative,0.030891699716448784,0.94685298204422,0.022255312651395798,"Investment & Development Bank surges to 2996 new accounts in Q2, exceeding custo...",finbert_v1.0,2026-06-27 12:15:38
2026-06-25,BID,BID_ART_004,0.017862074077129364,Neutral,0.02807389199733734,0.010211818851530552,0.9617143273353577,Investment & Development Bank faces regulatory scrutiny over compliance requirem...,finbert_v1.0,2026-06-27 12:15:38
2026-06-25,HDB,HDB_ART_000,0.010422417894005775,Neutral,0.020218851044774055,0.00979643315076828,0.9699848294258118,HDB faces downward pressure from foreign investors selling amid Banking sector w...,finbert_v1.0,2026-06-27 12:15:38
2026-06-25,HDB,HDB_ART_001,0.2786900997161865,Positive,0.6310532093048096,0.35236310958862305,0.01658368483185768,Housing Development Bank Board approves cash dividend of 2629 VND per share for ...,finbert_v1.0,2026-06-27 12:15:38
2026-06-25,HDB,HDB_ART_002,-0.8670329451560974,Negative,0.04806835576891899,0.9151012897491455,0.036830369383096695,HDB experiences increased competition from foreign banks entering Vietnamese Ban...,finbert_v1.0,2026-06-27 12:15:38
2026-06-25,MBB,MBB_ART_000,0.4316817820072174,Positive,0.7087621092796326,0.27708032727241516,0.014157550409436226,Military Commercial Joint Stock Bank Board approves cash dividend of 2810 VND pe...,finbert_v1.0,2026-06-27 12:15:38
2026-06-25,MBB,MBB_ART_001,-0.9133362770080566,Negative,0.03173186630010605,0.9450681209564209,0.023200061172246933,"Military Commercial Joint Stock Bank surges to 2191 new accounts in Q2, exceedin...",finbert_v1.0,2026-06-27 12:15:38
2026-06-25,MBB,MBB_ART_002,-0.004549678415060043,Neutral,0.013076148927211761,0.017625827342271805,0.9692980647087097,"MBB warns of rising credit costs and narrowing net interest margin in H1 2026, c...",finbert_v1.0,2026-06-27 12:15:38
2026-06-25,MBB,MBB_ART_003,0.017363600432872772,Neutral,0.027759214863181114,0.010395613498985767,0.9618452191352844,Military Commercial Joint Stock Bank faces regulatory scrutiny over compliance r...,finbert_v1.0,2026-06-27 12:15:38
2026-06-25,MBB,MBB_ART_004,-0.9124305248260498,Negative,0.03556862846016884,0.9479991793632507,0.016432173550128937,Military Commercial Joint Stock Bank signs strategic partnership with leading Ba...,finbert_v1.0,2026-06-27 12:15:38
2026-06-25,MSN,MSN_ART_000,-0.016833379864692688,Neutral,0.00899625662714243,0.025829635560512543,0.9651740789413452,Masan Group faces margin compression as operating costs rise faster than revenue...,finbert_v1.0,2026-06-27 12:15:38
2026-06-25,MSN,MSN_ART_001,0.6289578080177307,Positive,0.8084685206413269,0.1795107126235962,0.012020736932754517,"Masan Group Board approves cash dividend of 3659 VND per share for 2026, payable...",finbert_v1.0,2026-06-27 12:15:38
2026-06-25,MSN,MSN_ART_002,-0.9167460799217224,Negative,0.03259674087166786,0.9493428468704224,0.018060404807329178,"Masan Group receives 'Buy' recommendation from leading brokerage, target price r...",finbert_v1.0,2026-06-27 12:15:38
2026-06-25,MSN,MSN_ART_003,-0.0034795692190527916,Neutral,0.013725356198847294,0.017204925417900085,0.9690696597099304,"MSN warns of rising credit costs and narrowing net interest margin in H1 2026, c...",finbert_v1.0,2026-06-27 12:15:38
2026-06-25,PGV,PGV_ART_000,-0.9154329299926758,Negative,0.03519950807094574,0.9506324529647827,0.014168042689561844,Petrovietnam Gas signs strategic partnership with leading Energy firm to enhance...,finbert_v1.0,2026-06-27 12:15:38
2026-06-25,PGV,PGV_ART_001,-0.0004704669117927551,Neutral,0.016778049990534782,0.017248516902327538,0.965973436832428,"PGV warns of rising credit costs and narrowing net interest margin in H1 2026, c...",finbert_v1.0,2026-06-27 12:15:38
2026-06-25,PGV,PGV_ART_002,-0.9236754179000854,Negative,0.028970886021852493,0.9526463150978088,0.018382782116532326,"Petrovietnam Gas opens new branch network in 7 provinces across Vietnam, strengt...",finbert_v1.0,2026-06-27 12:15:38
2026-06-25,PGV,PGV_ART_003,-0.8632902503013611,Negative,0.0497843362390995,0.9130746126174927,0.03714107722043991,PGV experiences increased competition from foreign banks entering Vietnamese Ene...,finbert_v1.0,2026-06-27 12:15:38
2026-06-25,PGV,PGV_ART_004,-0.14572042226791382,Negative,0.378261923789978,0.5239823460578918,0.09775571525096893,PGV announces interim dividend of 1707 VND per share with record payout ratio...,finbert_v1.0,2026-06-27 12:15:38
2026-06-25,PLX,PLX_ART_000,0.015960630029439926,Neutral,0.025921063497662544,0.009960433468222618,0.964118480682373,Petrovietnam Power downgraded to 'Hold' by securities firm citing rising bad deb...,finbert_v1.0,2026-06-27 12:15:38
2026-06-25,PLX,PLX_ART_001,-0.9199401140213013,Negative,0.0295400507748127,0.9494801759719849,0.02097977139055729,"Petrovietnam Power surges to 2067 new accounts in Q2, exceeding customer acquisi...",finbert_v1.0,2026-06-27 12:15:38
2026-06-25,PLX,PLX_ART_002,-0.9115206003189087,Negative,0.036135926842689514,0.947656512260437,0.016207605600357056,"Petrovietnam Power receives 'Buy' recommendation from leading brokerage, target ...",finbert_v1.0,2026-06-27 12:15:38
2026-06-25,PNJ,PNJ_ART_000,-0.9256389141082764,Negative,0.02398979663848877,0.9496287107467651,0.026381568983197212,PNJ upgraded to 'Outperform' by investment bank citing strong fundamentals and g...,finbert_v1.0,2026-06-27 12:15:38
2026-06-25,PNJ,PNJ_ART_001,-0.4337221086025238,Negative,0.27983734011650085,0.7135594487190247,0.006603204645216465,PNJ invests 951 billion VND in new technology platform to digitize customer serv...,finbert_v1.0,2026-06-27 12:15:38
2026-06-25,PNJ,PNJ_ART_002,-0.021316319704055786,Neutral,0.009435023181140423,0.030751341953873634,0.9598137736320496,Phu Nhuan Jewelry faces margin compression as operating costs rise faster than r...,finbert_v1.0,2026-06-27 12:15:38
